{
  "$schema": "http://json-schema.org/draft-07/schema#",
  "title": "Presentation Theme",
  "type": "object",
  "required": ["name", "colors", "typography", "spacing", "motif", "background_modes"],
  "properties": {
    "name": { "type": "string" },
    "display_name": { "type": "string" },
    "description": { "type": "string" },
    "colors": {
      "type": "object",
      "required": ["primary", "secondary", "accent", "background", "text", "text_reversed"],
      "properties": {
        "primary": { "type": "string", "pattern": "^#[0-9A-Fa-f]{6}$" },
        "secondary": { "type": "string", "pattern": "^#[0-9A-Fa-f]{6}$" },
        "accent": { "type": "string", "pattern": "^#[0-9A-Fa-f]{6}$" },
        "background": { "type": "string", "pattern": "^#[0-9A-Fa-f]{6}$" },
        "text": { "type": "string", "pattern": "^#[0-9A-Fa-f]{6}$" },
        "text_reversed": { "type": "string", "pattern": "^#[0-9A-Fa-f]{6}$" },
        "muted": { "type": "string", "pattern": "^#[0-9A-Fa-f]{6}$" },
        "border": { "type": "string", "pattern": "^#[0-9A-Fa-f]{6}$" }
      }
    },
    "typography": {
      "type": "object",
      "required": ["header_font", "body_font", "title_size", "header_size", "body_size"],
      "properties": {
        "header_font": { "type": "string" },
        "body_font": { "type": "string" },
        "display_size": { "type": "string", "description": "80-120px. Hero slides, single powerful words." },
        "stat_size": { "type": "string", "description": "64-96px. Big numbers, KPIs." },
        "title_size": { "type": "string" },
        "header_size": { "type": "string" },
        "body_size": { "type": "string" },
        "caption_size": { "type": "string" },
        "overline_size": { "type": "string", "description": "11-13px. Uppercase category labels." },
        "line_height": { "type": "string" }
      }
    },
    "spacing": {
      "type": "object",
      "required": ["margin", "gap", "density"],
      "properties": {
        "margin": { "type": "string" },
        "gap": { "type": "string" },
        "density": { "type": "string", "enum": ["compact", "comfortable", "spacious"] }
      }
    },
    "motif": { "type": "string" },
    "motif_css_path": { "type": "string", "description": "Path to theme motif CSS file relative to plugin root" },
    "background_modes": {
      "type": "array",
      "items": { "type": "string", "enum": ["light", "colored", "reversed"] }
    }
  }
}
