{
  "name": "keynote-minimal",
  "display_name": "Keynote Minimal",
  "description": "Apple-style clean presentation with generous whitespace and subtle accents",
  "colors": {
    "primary": "#1D1D1F",
    "secondary": "#86868B",
    "accent": "#0071E3",
    "background": "#FFFFFF",
    "text": "#1D1D1F",
    "text_reversed": "#FFFFFF",
    "muted": "#86868B",
    "border": "#D2D2D7"
  },
  "typography": {
    "header_font": "SF Pro Display, Helvetica Neue, Arial, sans-serif",
    "body_font": "SF Pro Text, Helvetica Neue, Arial, sans-serif",
    "display_size": "96px",
    "stat_size": "72px",
    "title_size": "48px",
    "header_size": "28px",
    "body_size": "18px",
    "caption_size": "14px",
    "overline_size": "12px",
    "line_height": "1.5"
  },
  "spacing": {
    "margin": "80px",
    "gap": "40px",
    "density": "spacious"
  },
  "motif": "clean-whitespace",
  "motif_css_path": "themes/keynote-minimal/motif.css",
  "background_modes": ["light", "reversed"]
}
