{
  "name": "data-story",
  "display_name": "Data Story",
  "description": "Analytics-focused presentation with cool grays and data accent colors",
  "colors": {
    "primary": "#2D3748",
    "secondary": "#4A5568",
    "accent": "#3182CE",
    "background": "#F7FAFC",
    "text": "#1A202C",
    "text_reversed": "#F7FAFC",
    "muted": "#A0AEC0",
    "border": "#E2E8F0"
  },
  "typography": {
    "header_font": "IBM Plex Sans, Roboto, sans-serif",
    "body_font": "IBM Plex Sans, Roboto, sans-serif",
    "display_size": "88px",
    "stat_size": "72px",
    "title_size": "44px",
    "header_size": "24px",
    "body_size": "16px",
    "caption_size": "12px",
    "overline_size": "11px",
    "line_height": "1.5"
  },
  "spacing": {
    "margin": "64px",
    "gap": "32px",
    "density": "compact"
  },
  "motif": "data-grid-lines",
  "motif_css_path": "themes/data-story/motif.css",
  "background_modes": ["light", "colored", "reversed"]
}
